{
  "schema_version": "1.0",
  "run_id": "run-example0001",
  "state": "verified",
  "provider": {
    "registry_key": "provider-a",
    "requested_model": "model-a",
    "actual_model": "model-a-2026-09",
    "provider_request_id": null
  },
  "timing": {"queue_ms": 210, "execution_ms": 4200, "provider_ms": 1800, "total_ms": 4410},
  "usage": {"input_tokens": 1200, "output_tokens": 600, "estimated_cost_microusd": 25000, "pricing_snapshot": "2026-09-28"},
  "validators": [
    {"id": "orientation-facts", "version": "1.0.0", "required": true, "status": "passed", "score": 0.95, "exit_code": 0, "evidence_artifact_ids": ["artifact-example0001"]}
  ],
  "metrics": {"fact_precision": 0.95, "fact_recall": 0.9},
  "artifact_ids": ["artifact-example0001"],
  "error": null,
  "recorded_at": "2026-09-28T18:05:00Z"
}
